<?xml version="1.0" encoding="UTF-8"?>
<xs:schema xmlns:xs="http://www.w3.org/2001/XMLSchema">

    <xs:element name="students">
        <xs:complexType>
            <xs:sequence>
                <xs:element name="student" maxOccurs="unbounded">
                    <xs:complexType>
                        <xs:sequence>
                            <xs:element name="studentId" type="xs:int"/>
                            <xs:element name="name" type="xs:string"/>
                            <xs:element name="surname" type="xs:string"/>
                            <xs:element name="dateOfBirth" type="xs:date"/>
                            <xs:element name="phoneNumber" type="xs:string"/>
                            <xs:element name="email" type="xs:string"/>
                            <xs:element name="careerId" type="xs:int"/>
                        </xs:sequence>
                    </xs:complexType>
                </xs:element>
            </xs:sequence>
        </xs:complexType>
    </xs:element>

</xs:schema>
